{
  "$schema": "../../src/loader/package/src/registry/manifest.schema.json",
  "id": "sf-no-resource-cost",
  "name": "SF No Resource Cost",
  "version": "1.1.1",
  "description": "Sets the sixth argument of a shared inventory helper to zero in the current process. Verified callers include building, crafting, item usage and other systems; this is not restricted to recipe costs.",
  "authors": [
    "bonsaibauer"
  ],
  "license": null,
  "icon": "icon.svg",
  "dependencies": [],
  "capabilities": [
    "runtime"
  ]
}
