{
  "$schema": "../../src/loader/package/src/registry/manifest.schema.json",
  "id": "sf-infinite-item-use",
  "name": "SF Infinite Item Use",
  "version": "1.1.1",
  "description": "Prevents items from being consumed when used.",
  "authors": [
    "bonsaibauer"
  ],
  "license": null,
  "icon": "icon.svg",
  "dependencies": [],
  "capabilities": [
    "runtime"
  ]
}
