{
  "$schema": "../../modules/modloader/manifest/manifest.schema.json",
  "id": "sf-unlimited-flight",
  "name": "SF Unlimited Flight",
  "version": "1.2.0",
  "description": "Adjusts glider stamina and flight controls.",
  "authors": [
    "bonsaibauer"
  ],
  "license": null,
  "icon": "icon.svg",
  "dependencies": [],
  "capabilities": [
    "runtime"
  ]
}
