{
  "id": "xhl-auto-loot",
  "name": "Auto Loot",
  "version": "1.5.0",
  "capabilities": [
    "patch"
  ],
  "description": "Automatically collects harvest drops within 5 meters by default after checking the name whitelist and components. Stabilizes drops from harvestable nodes, skips the vanilla initial random delay of 0 to 5 seconds, and suppresses rejected InventoryFull retries without affecting valid stack merges.",
  "authors": [
    "XHL"
  ],
  "license": "MIT"
}
