{
  "$schema": "../../modules/modloader/manifest/manifest.schema.json",
  "id": "sf-survival",
  "name": "SF Survival",
  "version": "1.0.0",
  "description": "Adds settings for fall damage, health and mana regeneration, stamina, underwater breathing, weapon durability and cold protection.",
  "authors": [
    "bonsaibauer"
  ],
  "license": null,
  "icon": "icon.svg",
  "dependencies": [],
  "capabilities": [
    "runtime"
  ]
}
