{
  "$schema": "../../src/loader/package/src/registry/manifest.schema.json",
  "id": "sf-infinite-item-split",
  "name": "SF Infinite Item Split",
  "version": "1.4.0",
  "description": "Prevents the selected split amount from being removed from the source stack with a build-profile-verified, split-specific runtime patch.",
  "authors": [
    "bonsaibauer"
  ],
  "license": null,
  "icon": "icon.svg",
  "dependencies": [],
  "capabilities": [
    "runtime"
  ]
}
