{
  "id": "xhl-auto-loot",
  "name": "Auto Loot",
  "version": "1.5.0",
  "capabilities": [
    "patch"
  ],
  "description": "By default, automatically collects gathering drops that pass name-whitelist and component checks within 5 meters. Stabilizes gathering-node drops, skips the vanilla initial random delay of 0-5 seconds, and suppresses repeated InventoryFull retries for rejected items without affecting valid stack merges.",
  "authors": [
    "XHL"
  ],
  "license": "MIT"
}
