{
  "$schema": "../../src/loader/package/src/registry/manifest.schema.json",
  "id": "KPMimic",
  "name": "KFC Parser Mimic",
  "version": "0.0.1",
  "description": "Exports game data in a format similar to KFC Parser.",
  "authors": [
    "madduma"
  ],
  "license": null,
  "icon": null,
  "dependencies": [],
  "capabilities": [
    "export"
  ]
}
