{
  "id": "xhl-grappling-hook-pull-2x",
  "name": "2x Grappling Hook Pull Distance",
  "version": "1.0.0",
  "capabilities": [
    "patch"
  ],
  "description": "Doubles the actual pull distance of all grappling hooks; swing distance remains unchanged.",
  "authors": [
    "XHL"
  ],
  "license": "MIT"
}
