{
  "id": "xhl-unlimited-flame-altars",
  "name": "Unlimited Flame Altars",
  "version": "3.0.1",
  "capabilities": [
    "patch"
  ],
  "description": "Removes the Flame Altar limit by dynamically handling the PlayerBases area registry and the 32-slot BuildingZones receiver array.",
  "authors": [
    "XHL"
  ],
  "license": "MIT"
}
