{
  "$schema": "../../src/loader/package/src/registry/manifest.schema.json",
  "id": "sf-world-editor",
  "name": "World Editor",
  "version": "0.2.0",
  "description": "World editing shortcuts: F4 undo, F5 mark A/B, F6 reset, F7 paste at the cursor, and F8 capture/save/select. F9 opens the Modloader UI; F10 opens the Debug Console.",
  "authors": [
    "bonsaibauer"
  ],
  "license": null,
  "icon": "icon.svg",
  "dependencies": [],
  "capabilities": [
    "runtime",
    "export"
  ]
}
