{
  "$schema": "../../src/loader/package/src/registry/manifest.schema.json",
  "id": "sf-no-stamina-loss",
  "name": "SF No Stamina Loss",
  "version": "1.1.1",
  "description": "Prevents stamina depletion with the build-profile-verified native patch.",
  "authors": [
    "bonsaibauer"
  ],
  "license": null,
  "icon": "icon.svg",
  "dependencies": [],
  "capabilities": [
    "runtime"
  ]
}
